id,name,artist,event_local_date,event_local_time,venue,city,country,url
1AyZkkAGkemAoaJ,MJ LIVE Ticket + Hotel Deals,MJ LIVE - Michael Jackson Tribute,2024-12-05,20:00:00,Harrah's Showroom at Harrah's Las Vegas,Las Vegas,United States Of America,https://travel.ticketmaster.com/attraction/825?_uid=2d1a81bc-09c6-45ae-ba80-43c6cfcac5ca&utm_source=Caesars_TM&utm_medium=TM_ADP_MJLive
k7vGFbinMFPq9,MET Live in HD: El Ultimo Sueno De Frida Y Diego,Gabriela Lena Frank,2025-01-01,13:00:00,Ulster Performing Arts Center,Kingston,United States Of America,https://www.ticketmaster.com/met-live-in-hd-el-ultimo-kingston-new-york-01-01-2025/event/000062CAB7225757
G5vYZb9hmjUMe,3rd Thursday Tribute Series Ticket Pass,,2025-01-16,,The Venue at Thunder Valley Casino Resort,Lincoln,United States Of America,https://www.ticketmaster.com/3rd-thursday-tribute-series-ticket-pass-lincoln-california-01-16-2025/event/1C006176EE736DC2
k7vGFbK3iS0VE,Billy Joel & Sting,Billy Joel,2025-04-11,20:00:00,JMA Wireless Dome ,Syracuse,United States Of America,https://www.ticketmaster.com/billy-joel-sting-syracuse-new-york-04-11-2025/event/00006134ACCE4D27
vvG1YZbI2KoVMH,Atif Aslam,Atif Aslam,2025-05-31,19:30:00,Comerica Center,Frisco,United States Of America,https://www.ticketmaster.com/atif-aslam-frisco-texas-05-31-2025/event/0C006283D3474DFC
G5vYZbITmzNHw,Doble R Entertainment Presents: Summer Take Off,Doble R Entertainment,2025-06-26,19:00:00,Ace of Spades,Sacramento,United States Of America,https://www.ticketmaster.com/doble-r-entertainment-presents-summer-take-sacramento-california-06-26-2025/event/1C00628FEEE23F32
G5viZblFk3pMO,"Denim and Diamonds Tour w/ Sir Charles Jones, Jay Morris and Myia B",Sir Charles Jones,2025-06-29,19:00:00,Minglewood Hall,Memphis,United States Of America,https://www.ticketmaster.com/denim-and-diamonds-tour-w-sir-memphis-tennessee-06-29-2025/event/1B0062B206496DE0
1Ad0ZbYGkDbfd1v,Wayne Newton + Hotel Deals,Wayne Newton,2025-08-14,19:00:00,Bugsy's Cabaret at Flamingo,Las Vegas,United States Of America,https://travel.ticketmaster.com/attraction/167?_uid=2d1a81bc-09c6-45ae-ba80-43c6cfcac5ca&utm_source=Caesars_TM&utm_medium=Wayne_Newton_ADP
G5viZbmRJBgQk,Welcome Home Tour: Rio Da Yung Og,Rio Da Yung Og,2025-08-25,20:00:00,Minglewood Hall,Memphis,United States Of America,https://www.ticketmaster.com/welcome-home-tour-rio-da-yung-memphis-tennessee-08-25-2025/event/1B0062EBE6EB5686
1kC8vNaZGACP4av,Donny Osmond Ticket + Hotel Deals,Donny Osmond (Las Vegas),2025-09-05,19:30:00,Harrah's Showroom at Harrah's Las Vegas,Las Vegas,United States Of America,https://travel.ticketmaster.com/attraction/48218?_uid=2d1a81bc-09c6-45ae-ba80-43c6cfcac5ca&utm_source=Caesars_TM&utm_medium=Donny_Osmond_ADP
1AsZkudGkeidJEi,The Festival of Small Halls,The Festival of Small Halls,2025-10-03,,Ontario Small Halls,Ottawa,Canada,https://on.fgtix.com/trk/l4W4b
1ad0ZbVr9o8Zdud7,Rod Stewart Tickets + Hotel Deals,Rod Stewart,2025-10-07,19:30:00,The Colosseum at Caesars Palace,Las Vegas,United States Of America,https://travel.ticketmaster.com/attraction/2731?cityName=Las%20Vegas&stateCode=NV&countryCode=US&_uid=2d1a81bc-09c6-45ae-ba80-43c6cfcac5ca&utm_source=Caesars&utm_medium=TM_ADP_Rstewart
1ad0ZbVr9oOZdukk,Def Leppard Tickets + Hotel Deals,Def Leppard,2025-10-07,19:30:00,The Colosseum at Caesars Palace,Las Vegas,United States Of America,https://travel.ticketmaster.com/attraction/976?cityName=Las%20Vegas&stateCode=NV&countryCode=US&_uid=2d1a81bc-09c6-45ae-ba80-43c6cfcac5ca&utm_source=Caesars_TM&utm_medium=TM_ADP_DefLeppard
1AyZkuFGkeYc3Ku,Cyndi Lauper Tickets + Hotel Deals,Cyndi Lauper,2025-10-08,20:00:00,The Colosseum at Caesars Palace,Las Vegas,United States Of America,https://travel.ticketmaster.com/attraction/10501?cityName=Las%20Vegas&stateCode=NV&countryCode=US&_uid=2d1a81bc-09c6-45ae-ba80-43c6cfcac5ca&utm_source=Caesars_TM&utm_medium=TM_ADP_CyndiLauperVegas
1AyZkuFGkeYcwf1,Tim McGraw Tickets + Hotel Deals,Tim McGraw,2025-10-08,20:00:00,The Colosseum at Caesars Palace,Las Vegas,United States Of America,https://travel.ticketmaster.com/attraction/1755?cityName=Las%20Vegas&stateCode=NV&countryCode=US&_uid=2d1a81bc-09c6-45ae-ba80-43c6cfcac5ca&utm_source=Caesars_TM&utm_medium=TM_ADP_TimMcGrawVegas
G5dIZbYNrV0lW,Tracy Lawrence - Neon Lights Cowboy Concert Series,Tracy Lawrence,2025-10-17,20:00:00,Payne Arena,Hidalgo,United States Of America,https://www.ticketmaster.com/tracy-lawrence-neon-lights-cowboy-concert-hidalgo-texas-10-17-2025/event/3A006308DED24AFD
G5eVZbYkS29Sb,Scorey - IYFL TOUR,Scorey,2025-10-24,20:00:00,Music Farm,Charleston,United States Of America,https://www.ticketmaster.com/scorey-iyfl-tour-charleston-south-carolina-10-24-2025/event/2D006301B33D7CD8
1AvZZbSGkl7HU3B,OVO Presents Vybz Kartel,Vybz Kartel,2025-10-27,20:00:00,Scotiabank Arena,Toronto,Canada,https://www.ticketmaster.ca/ovo-presents-vybz-kartel-toronto-ontario-10-27-2025/event/1000633AC4F364BA
G5dIZbIcO8ZMP,Quevedo -Buenas Noches USA Tour,Quevedo,2025-10-31,19:00:00,House of Blues Houston,Houston,United States Of America,https://www.ticketmaster.com/quevedo-buenas-noches-usa-tour-houston-texas-10-31-2025/event/3A00628B60400DE5
vvG1jZbRNxe71P,"Scott Bradlee's Postmodern Jukebox - Magic, Moonlight & Mistletoe Tour",Scott Bradlee's Postmodern Jukebox,2025-11-20,20:00:00,Genesee Theatre,Waukegan,United States Of America,https://www.ticketmaster.com/scott-bradlees-postmodern-jukebox-magic-moonlight-waukegan-illinois-11-20-2025/event/070062F8E20842A5
G5vVZbw63zdXy,Widespread Panic 3 Day Ticket - Cannot Be Split By Day,Widespread Panic,2025-11-21,,The Capitol Theatre,Port Chester,United States Of America,https://www.ticketmaster.com/widespread-panic-3-day-ticket-cannot-port-chester-new-york-11-21-2025/event/1D006321D2E03FB9
rZ7HnEZ1AfbMvK,Jazz Brunch: Mando Cordova,,2025-11-23,12:30:00,Ivan'z House at Mozambique,Laguna Beach,United States Of America,https://www.ticketweb.com/event/jazz-brunch-mando-cordova-ivanz-house-at-mozambique-tickets/14637053
k7vGFbYTYlgWm,Late Night Thoughts with special guest Alnev,Late Night Thoughts,2025-11-23,17:00:00,Mercury Lounge,New York,United States Of America,https://www.ticketmaster.com/late-night-thoughts-with-special-guest-new-york-new-york-11-23-2025/event/0000630FF0AF5F6E
rZ7HnEZ1Af4ejS,Saintseneca w/ Radiator Hospital & Superviolet,Saintseneca,2025-11-23,17:00:00,Rumba Cafe,Columbus,United States Of America,https://www.ticketweb.com/event/saintseneca-radiator-hospital-superviolet-rumba-cafe-tickets/14542733
vv178ZbUGkDpOy76,LSC x VeryThat! Presents Aluna,Aluna,2025-11-23,16:00:00,Outset,Chicago,United States Of America,https://www.ticketmaster.com/lsc-x-verythat-presents-aluna-chicago-illinois-11-23-2025/event/0400636ED6839107
rZ7HnEZ1Afbx-S,"Nü Skool, Lamb Of God, Seputura/Soulfly, HIM, Mötley Crue Tributes - Ditch Day Fest",,2025-11-23,14:30:00,Garden Amphitheatre,Garden Grove,United States Of America,https://www.ticketweb.com/event/n-skool-lamb-of-god-garden-amphitheatre-tickets/14622873
177ZvxG621jhxPg,Waterparks: The Prowler Tour,Waterparks,2025-11-23,18:00:00,History,Toronto,Canada,https://www.ticketmaster.ca/waterparks-the-prowler-tour-toronto-ontario-11-23-2025/event/100062F29C6E2975
177ZvxG6uzbmAVR,David Broza,David Broza,2025-11-23,18:00:00,The Danforth Music Hall,Toronto,Canada,https://www.ticketmaster.ca/david-broza-toronto-ontario-11-23-2025/event/100062DE18B85D2F
17A8vxG6uxJzwQW,Alabama Live In Concert,Alabama,2025-11-23,18:00:00,EagleBank Arena,Fairfax,United States Of America,https://www.ticketmaster.com/alabama-live-in-concert-fairfax-virginia-11-23-2025/event/150062D8A6E326BD
17AOvxG6GMbV9Q1,Fit for a King,Fit for a King,2025-11-23,18:00:00,Bogart's,Cincinnati,United States Of America,https://www.ticketmaster.com/fit-for-a-king-cincinnati-ohio-11-23-2025/event/160062CDD8D1768A
17FOvxG6C0ol-2g,Set It Off: The Self Titled Tour,Set It Off,2025-11-23,18:00:00,House of Blues Orlando,Orlando,United States Of America,https://www.ticketmaster.com/set-it-off-the-self-titled-orlando-florida-11-23-2025/event/220062E911AE13F5
G5eVZbRxYeUw6,Sanguisugabogg,Sanguisugabogg,2025-11-23,18:00:00,The Underground,Charlotte,United States Of America,https://www.ticketmaster.com/sanguisugabogg-charlotte-north-carolina-11-23-2025/event/2D0062F8B00B6C87
G5eVZbcKkXzER,Allen Stone and Ripe - The Get Sweet Tour,Allen Stone,2025-11-23,18:00:00,The Ritz,Raleigh,United States Of America,https://www.ticketmaster.com/allen-stone-and-ripe-the-get-raleigh-north-carolina-11-23-2025/event/2D0062D4C6FB89EF
k7vGFblHw5biF,Zakk Sabbath: American Winter Tour '25,Zakk Sabbath,2025-11-23,18:00:00,Warsaw,Brooklyn,United States Of America,https://www.ticketmaster.com/zakk-sabbath-american-winter-tour-25-brooklyn-new-york-11-23-2025/event/000062BF322D8B08
rZ7HnEZ1AfQ7uK,Reggae Sunday (Early Show): Einstein Brown,,2025-11-23,15:00:00,Ivan'z House at Mozambique,Laguna Beach,United States Of America,https://www.ticketweb.com/event/reggae-sunday-early-show-einstein-ivanz-house-at-mozambique-tickets/14684353
vv168vNeoQeZ757Fe,Bit Brigade & Galactic Empire Plays Mega Man X,Bit Brigade,2025-11-23,18:30:00,Brighton Music Hall presented by Citizens,Boston,United States Of America,https://www.ticketmaster.com/bit-brigade-galactic-empire-plays-mega-boston-massachusetts-11-23-2025/event/010063091682A371
vv177ZbsGkSYF5Lp,All Time Low - EVERYONE'S TALKING! TOUR,All Time Low,2025-11-23,18:30:00,MGM Music Hall at Fenway,Boston,United States Of America,https://www.ticketmaster.com/all-time-low-everyones-talking-tour-boston-massachusetts-11-23-2025/event/0100631CF020B7D6
vvG17Zbm1XdgrG,THE MOVEMENT - VISIONS TOUR With Special Guests Kabaka Pyramid,The Movement,2025-11-23,18:30:00,Citizens House of Blues Boston,Boston,United States Of America,https://www.ticketmaster.com/the-movement-visions-tour-with-special-boston-massachusetts-11-23-2025/event/010062E2BE0F578C
177ZvxG6CGRrAWF,D Smoke - Wake Up Supa Tour,D Smoke,2025-11-23,19:00:00,The Mod Club (formerly known as The Axis Club),Toronto,Canada,https://www.ticketmaster.ca/d-smoke-wake-up-supa-tour-toronto-ontario-11-23-2025/event/100062E32F785F48
177ZvxG6GEN_KHM,DAX - Lonely Dirt Road Tour,Dax,2025-11-23,19:00:00,The Opera House,Toronto,Canada,https://www.ticketmaster.ca/dax-lonely-dirt-road-tour-toronto-ontario-11-23-2025/event/100062C9E3653F37
1AYZkG0Gkd1sAem,Yungeen Ace: I Am What They Don't See Tour,Yungeen Ace,2025-11-23,19:00:00,Arrow,Allentown,United States Of America,https://www.ticketmaster.com/yungeen-ace-i-am-what-they-allentown-pennsylvania-11-23-2025/event/30006324CAC450AE
1Ad7ZbEGkS7gfD5,Splean,Splean,2025-11-23,19:00:00,Théâtre Beanfield,Montreal,Canada,https://www.ticketmaster.ca/splean-montreal-quebec-11-23-2025/event/3100627CC4D54ECB
1AdZZbwGkmAlZBg,Rain,Rain,2025-11-23,19:00:00,Barclays Center,Brooklyn,United States Of America,https://www.ticketmaster.com/rain-brooklyn-new-york-11-23-2025/event/3000632B85AC0EB5
1AxZkGAGkdcxspX,Josh Baldwin - Made for More Tour,Josh Baldwin,2025-11-23,19:00:00,Hiland Park Baptist Church,Panama City,United States Of America,https://www.ticketmaster.com/josh-baldwin-made-for-more-tour-panama-city-florida-11-23-2025/event/22006305ED8B15BE
1AxZkGKGkdkzvmK,Jeezy & Friends Perform Live For Classic Weekend 2025,Jeezy,2025-11-23,19:00:00,Kia Center,Orlando,United States Of America,https://www.ticketmaster.com/jeezy-friends-perform-live-for-classic-orlando-florida-11-23-2025/event/22006313C6E01B93
G5ezZbYDS8f-3,Bob Marley Hope Road The Show,Bob Marley Hope Road The Show,2025-11-23,16:00:00,Bob Marley Hope Road,Las Vegas,United States Of America,https://www.ticketmaster.com/bob-marley-hope-road-the-show-las-vegas-nevada-11-23-2025/event/2E00630EF3414852
G5vVZbw6oCKyk,Widespread Panic,Widespread Panic,2025-11-23,19:00:00,The Capitol Theatre,Port Chester,United States Of America,https://www.ticketmaster.com/widespread-panic-port-chester-new-york-11-23-2025/event/1D006321D1393E46
Z7r9jZ1A7QAO-,Ne Obliviscaris w/ Rivers of Nihil,Ne Obliviscaris,2025-11-23,19:00:00,Piere's,Fort Wayne,United States Of America,https://www.ticketmaster.com/event/Z7r9jZ1A7QAO-
Z7r9jZ1A7QZjE,Dark Star Orchestra,Dark Star Orchestra,2025-11-23,19:00:00,Ithaca's State Theatre,Ithaca,United States Of America,https://www.ticketmaster.com/event/Z7r9jZ1A7QZjE
Z7r9jZ1A7_Iuy,Band Of Skulls - 21+,Band of Skulls,2025-11-23,19:00:00,Ardmore Music Hall,Ardmore,United States Of America,https://www.ticketmaster.com/event/Z7r9jZ1A7_Iuy
Z7r9jZ1A7_Of3,Chris Lake (21+),Chris Lake,2025-11-23,18:00:00,SILO,Dallas,United States Of America,https://www.ticketmaster.com/event/Z7r9jZ1A7_Of3
Z7r9jZ1A7_ab4,Micah Tyler,Micah Tyler,2025-11-23,19:00:00,Hyland Heights Baptist Church,Rustburg,United States Of America,https://www.ticketmaster.com/event/Z7r9jZ1A7_ab4
Z7r9jZ1A7_k17,Atreyu,Atreyu,2025-11-23,19:00:00,Palladium-MA,Worcester,United States Of America,https://www.ticketmaster.com/event/Z7r9jZ1A7_k17
Z7r9jZ1A7jgfJ,Aaron Lewis and The Stateliners,Aaron Lewis,2025-11-23,18:00:00,The Caverns,Pelham,United States Of America,https://www.ticketmaster.com/event/Z7r9jZ1A7jgfJ
Z7r9jZ1A7pooK,Rend Collective,Rend Collective,2025-11-23,19:00:00,The Maryland Theatre,Hagerstown,United States Of America,https://www.ticketmaster.com/event/Z7r9jZ1A7pooK
k7vGFbRTgfB20,Like Moths To Flames,Like Moths To Flames,2025-11-23,19:00:00,Gramercy Theatre,New York,United States Of America,https://www.ticketmaster.com/like-moths-to-flames-new-york-new-york-11-23-2025/event/000062FFF553A3E4
k7vGFbRkYc4X4,Robyn Hitchcock,Robyn Hitchcock,2025-11-23,19:00:00,Bowery Ballroom,New York,United States Of America,https://www.ticketmaster.com/robyn-hitchcock-new-york-new-york-11-23-2025/event/000062F1B0B55F95
k7vGFbcR1wIUR,Queensryche - Volume and Vengeance Tour,Queensryche,2025-11-23,19:00:00,The Paramount in concert with Northwell,Huntington,United States Of America,https://www.ticketmaster.com/queensryche-volume-and-vengeance-tour-huntington-new-york-11-23-2025/event/000062DBCACA8DAF
k7vGFblSQLzsB,Adam Pascal,Adam Pascal,2025-11-23,19:00:00,Tilles Center - Krasnoff Theater,Brookville,United States Of America,https://www.ticketmaster.com/adam-pascal-brookville-new-york-11-23-2025/event/000062BCDA7F8C7A
k7vGFbnpR9oW5,Leon Thomas - Mutts Don't Heel Tour,Leon Thomas,2025-11-23,19:00:00,Brooklyn Paramount,Brooklyn,United States Of America,https://www.ticketmaster.com/leon-thomas-mutts-dont-heel-tour-brooklyn-new-york-11-23-2025/event/000062A5AF5D1F4B
rZ7HnEZ1AK-IP0,"God Did It Tour with Micah Tyler ft. Jordan St. Cyr & Emerson Day - Rustburg, VA",,2025-11-23,19:00:00,Hyland Heights Baptist Church,Rustburg,United States Of America,https://www.ticketweb.com/event/god-did-it-tour-with-hyland-heights-baptist-church-tickets/13868964
rZ7HnEZ1AK0M_0,Radio Flashback: Your Ultimate 70s and 80s Rock n Roll Tribute Show!,,2025-11-23,19:00:00,Daryl's House,Pawling,United States Of America,https://www.ticketweb.com/event/radio-flashback-your-ultimate-70s-daryls-house-tickets/13937664
rZ7HnEZ1AKPJ47,"Tatiana Eva Marie: Paris, Je Taime!",,2025-11-23,19:00:00,Birdland Theater,New York,United States Of America,https://www.ticketweb.com/event/tatiana-eva-marie-paris-je-birdland-theater-tickets/13966544
rZ7HnEZ1AKPvO0,Memphis May Fire: THE SHAPESHIFTER TOUR LEG 2,Memphis May Fire,2025-11-23,19:00:00,Howard Theatre,Washington,United States Of America,https://www.ticketweb.com/event/memphis-may-fire-the-shapeshifter-howard-theatre-tickets/13941824
rZ7HnEZ1Af8foN,RUMOURS ATL - A Fleetwood Mac Tribute,,2025-11-23,19:00:00,District 142,Wyandotte,United States Of America,https://www.ticketweb.com/event/rumours-atl-a-district-142-tickets/14414463
rZ7HnEZ1AfCZ4d,Rend Collective Folk! Tour,Rend Collective,2025-11-23,19:00:00,The Maryland Theatre,Hagerstown,United States Of America,https://www.ticketweb.com/event/rend-collective-folk-tour-the-maryland-theatre-tickets/14380543
rZ7HnEZ1AfQ98S,Brother Dusty & ratplay,,2025-11-23,19:00:00,The Winchester,Lakewood,United States Of America,https://www.ticketweb.com/event/brother-dusty-ratplay-the-winchester-tickets/14697433
rZ7HnEZ1Af_4ed,Murderous... Again: LYDIA LUNCH + TIM DAHL,Lydia Lunch,2025-11-23,19:00:00,B Side Lounge,Cleveland Heights,United States Of America,https://www.ticketweb.com/event/murderous-again-lydia-lunch-b-side-lounge-tickets/14655083
rZ7HnEZ1Afb6kd,PORTUGAL. THE MAN — Lords of Portland Tour,Portugal. The Man,2025-11-23,19:00:00,Skully's Music Diner,Columbus,United States Of America,https://www.ticketweb.com/event/portugal-the-man-lords-skullys-music-diner-tickets/14607183
rZ7HnEZ1AfbVud,TODAY IS THE DAY,Today Is the Day,2025-11-23,18:00:00,Club David,Sioux Falls,United States Of America,https://www.ticketweb.com/event/today-is-the-day-club-david-tickets/14634343
rZ7HnEZ1Affpvd,Mario Presents: The Nothing But Us Tour 2025,Mario,2025-11-23,19:00:00,The Concert Hall,Toronto,Canada,https://www.ticketweb.ca/event/mario-presents-the-nothing-but-the-concert-hall-tickets/14516043
rZ7HnEZ1AfpF0N,"Super Fest Vol. 1: Alfred Banks, Mega Ran, O_Super, Mag.Lo, and More",Mega Ran,2025-11-23,19:00:00,Conduit,Winter Park,United States Of America,https://www.ticketweb.com/event/super-fest-vol-1-alfred-conduit-tickets/14588923
vv17fZbsGkMaz3n4,Adam Hawley,Adam Hawley,2025-11-23,19:00:00,"John, James and Clara Knight Stage",Akron,United States Of America,https://www.ticketmaster.com/adam-hawley-akron-ohio-11-23-2025/event/0500631DC9E12A95
vv1AAZkk6GkdWO4iV,STING 3.0 Tour,Sting,2025-11-23,18:00:00,Hard Rock Live Northern Indiana,Gary,United States Of America,https://www.ticketmaster.com/sting-30-tour-gary-indiana-11-23-2025/event/05006187FD815B34
vv1FFZbwaAoIZdu1v,Chiodos - All's Well That Ends Well 20 Year Anniversary,Chiodos,2025-11-23,19:00:00,The Wellmont Theater,Montclair,United States Of America,https://www.ticketmaster.com/chiodos-alls-well-that-ends-well-montclair-new-jersey-11-23-2025/event/0200632245468C90
vvG17ZbnDZ57vi,Brandy & Monica: The Boy Is Mine Tour,Brandy,2025-11-23,19:00:00,Hampton Coliseum,Hampton,United States Of America,https://www.ticketmaster.com/brandy-monica-the-boy-is-mine-hampton-virginia-11-23-2025/event/010062AEC02C406C
vvG1VZbl9_QS5E,Stardust Presents: NEK USA Tour 2025,Nek,2025-11-23,19:00:00,Wells Hall at The Parker,Ft Lauderdale,United States Of America,https://www.ticketmaster.com/stardust-presents-nek-usa-tour-2025-ft-lauderdale-florida-11-23-2025/event/0D0062B5D96B32E7
vvG1fZbRr8o3id,Lamp - Future Behind Me,Lamp,2025-11-23,19:00:00,The Bluestone,Columbus,United States Of America,https://www.ticketmaster.com/lamp-future-behind-me-columbus-ohio-11-23-2025/event/050062F790452B03
vvG1jZbR9hHNb8,Home Free: Let Me Come Home Tour,Home Free,2025-11-23,18:00:00,Rialto Square Theatre,Joliet,United States Of America,https://www.ticketmaster.com/home-free-let-me-come-home-joliet-illinois-11-23-2025/event/070062F5DBF23610
vvG1zZbSLwgp_i,The Spooklights,The Spooklights,2025-11-23,19:00:00,The Masquerade - Purgatory,Atlanta,United States Of America,https://www.ticketmaster.com/the-spooklights-atlanta-georgia-11-23-2025/event/0E006337F2D5666C
vvG1zZbl3GLst2,Crowder & Zach Williams with Matt Maher Fall 2025,Crowder,2025-11-23,19:00:00,Columbus Civic Center,Columbus,United States Of America,https://www.ticketmaster.com/crowder-zach-williams-with-matt-maher-columbus-georgia-11-23-2025/event/0E0062B48C7F1A4F
vvG1zZbs2wkUQ-,Chloe Ament,Chloe Ament,2025-11-23,19:00:00,The Masquerade  - Altar,Atlanta,United States Of America,https://www.ticketmaster.com/chloe-ament-atlanta-georgia-11-23-2025/event/0E006313F21B66A1
17A8vxG61Jcn3I0,Vienna Teng,Vienna Teng,2025-11-23,19:30:00,Birchmere,Alexandria,United States Of America,https://www.ticketmaster.com/vienna-teng-alexandria-virginia-11-23-2025/event/150062A9ADA92A24
17A8vxG65hpYI5p,Avatar - In The Airwaves - USA 2025,Avatar,2025-11-23,19:30:00,The Fillmore Silver Spring,Silver Spring,United States Of America,https://www.ticketmaster.com/avatar-in-the-airwaves-usa-2025-silver-spring-maryland-11-23-2025/event/150062B6D6C282D6
1A8ZkGpGkdkh7o2,Kayhan Kalhor & Erdal Erzincan,Kayhan Kalhor,2025-11-23,19:30:00,Meridian Arts Centre: George Weston,Toronto,Canada,https://www.ticketmaster.ca/kayhan-kalhor-erdal-erzincan-toronto-ontario-11-23-2025/event/10006316C66C444F
1AvZZbYGkXjTvWr,Raymond Lam,Raymond Lam,2025-11-23,19:30:00,OLG Stage at Fallsview Casino,Niagara Falls,Canada,https://www.ticketmaster.ca/raymond-lam-niagara-falls-ontario-11-23-2025/event/1000630F9CFC1F5E
1kFZvNAaGA16wCO,T. Graham Brown,T. Graham Brown,2025-11-23,18:30:00,Montgomery Performing Arts Centre,Montgomery,United States Of America,https://www.ticketmaster.com/t-graham-brown-montgomery-alabama-11-23-2025/event/200063149A1F23A0
G5eVZbY93R7LN,The STARS Tour featuring Anne Wilson,Anne Wilson,2025-11-23,19:30:00,Steven Tanger Center for the Performing Arts,Greensboro,United States Of America,https://www.ticketmaster.com/the-stars-tour-featuring-anne-wilson-greensboro-north-carolina-11-23-2025/event/2D006305D2BC47E3
G5vVZbYmVsv4i,The Home Team,The Home Team,2025-11-23,19:30:00,Toad's Place,New Haven,United States Of America,https://www.etix.com/ticket/p/62488560/the-home-team-the-crucible-of-life-tour-new-haven-toads-place-of-new-haven
Z7r9jZ1A7Q4qf,The Jayhawks,The Jayhawks,2025-11-23,19:30:00,The Center for Arts in Natick,Natick,United States Of America,https://www.ticketmaster.com/event/Z7r9jZ1A7Q4qf
Z7r9jZ1A7Q6Fy,Senses Fail w/ Story of the Year,Senses Fail,2025-11-23,19:30:00,Roadrunner-Boston,Boston,United States Of America,https://www.ticketmaster.com/event/Z7r9jZ1A7Q6Fy
Z7r9jZ1A7Q6Fz,One Night of Queen,One Night of Queen,2025-11-23,19:30:00,Pompano Beach Amphitheatre,Pompano Beach,United States Of America,https://www.ticketmaster.com/event/Z7r9jZ1A7Q6Fz
Z7r9jZ1A7_YfV,The Home Team,The Home Team,2025-11-23,19:30:00,Toads Place - CT,New Haven,United States Of America,https://www.ticketmaster.com/event/Z7r9jZ1A7_YfV
Z7r9jZ1A7_yA6,The Crane Wives,The Crane Wives,2025-11-23,19:30:00,Higher Ground,South Burlington,United States Of America,https://www.ticketmaster.com/event/Z7r9jZ1A7_yA6
Z7r9jZ1A7ba46,Natalie Merchant,Natalie Merchant,2025-11-23,19:30:00,Maryland Hall for the Creative Arts,Annapolis,United States Of America,https://www.ticketmaster.com/event/Z7r9jZ1A7ba46
Z7r9jZ1A7qOvN,Crobot,Crobot,2025-11-23,19:30:00,MilkBoy Philadelphia,Philadelphia,United States Of America,https://www.ticketmaster.com/event/Z7r9jZ1A7qOvN
ZkDnngzZDdmZ6E5p1gk7IS3mB3Cpgak,Lissie Livestream from Jimmy's Jazz and Blues Club,Lissie,2025-11-23,19:30:00,Jimmy's Jazz and Blues Club,Portsmouth,United States Of America,https://veeps.com/jimmysjazzandbluesclub/ee0079cb-58ad-4612-8cd2-bba48e5b5246
rZ7HnEZ1AK0xfV,Econoline Crush with Army Of One & Nitetime Drive,Econoline Crush,2025-11-23,19:30:00,Biltmore Theatre,Oshawa,Canada,https://www.ticketweb.ca/event/econoline-crush-with-army-of-biltmore-theatre-tickets/13922534
rZ7HnEZ1Afpekd,Elk City • King Canutes (Album Release Party) • Dave Derby,Elk City,2025-11-23,19:30:00,Berlin,New York,United States Of America,https://www.ticketweb.com/event/elk-city-king-canutes-berlin-tickets/14582183
vv16vZkG_F3ZAG1ea6,Lissie with Special Guest Diana DeMuth,Lissie,2025-11-23,19:30:00,Jimmy's Jazz and Blues Club,Portsmouth,United States Of America,https://www.ticketmaster.com/lissie-with-special-guest-diana-demuth-portsmouth-new-hampshire-11-23-2025/event/01006319212B9186
vv17FZbSGknk2NfT,Tauren Wells,Tauren Wells,2025-11-23,19:30:00,The Pullo Center ,York,United States Of America,https://www.ticketmaster.com/tauren-wells-york-pennsylvania-11-23-2025/event/0200633A863E353F
vv17FZbYGkUXDwcr,Trans-Siberian Orchestra - The Ghosts Of Christmas Eve,Trans-Siberian Orchestra,2025-11-23,19:30:00,GIANT Center,Hershey,United States Of America,https://www.ticketmaster.com/transsiberian-orchestra-the-ghosts-of-christmas-hershey-pennsylvania-11-23-2025/event/0200630DBEEF2B5E
vv17OZbSGklOWf5T,Jonas Brothers: JONAS20 Greetings From Your Hometown,Jonas Brothers,2025-11-23,19:30:00,Little Caesars Arena,Detroit,United States Of America,https://www.ticketmaster.com/jonas-brothers-jonas20-greetings-from-your-detroit-michigan-11-23-2025/event/0800633AE0F542FF
vv17fZbYGkmy-ruI,Trey Anastasio Band,Trey Anastasio,2025-11-23,19:30:00,Akron Civic Theatre,Akron,United States Of America,https://www.ticketmaster.com/trey-anastasio-band-akron-ohio-11-23-2025/event/0500630BB985E368
vvG1OZbcCCQ-_O,Taylor Dayne,Taylor Dayne,2025-11-23,19:30:00,Sound Board at MotorCity Casino Hotel,Detroit,United States Of America,https://www.ticketmaster.com/taylor-dayne-detroit-michigan-11-23-2025/event/080062D38E6A1660
vvG1fZbiUb4-W3,Taylorville - A Tribute to Taylor Swift,Taylorville - A Tribute to Taylor Swift,2025-11-23,19:30:00,Clowes Memorial Hall,Indianapolis,United States Of America,https://www.ticketmaster.com/taylorville-a-tribute-to-taylor-swift-indianapolis-indiana-11-23-2025/event/050062CD98561F52
vvG1zZbRpLIsLh,Lecrae - Reconstruction World Tour,Lecrae,2025-11-23,19:30:00,Tabernacle,Atlanta,United States Of America,https://www.ticketmaster.com/lecrae-reconstruction-world-tour-atlanta-georgia-11-23-2025/event/0E0062F59FA317DB
1778vxG6Gp2GxuV,Silverstein: 25 Years Of Noise,Silverstein,2025-11-23,19:00:00,Burton Cummings Theatre,Winnipeg,Canada,https://www.ticketmaster.ca/silverstein-25-years-of-noise-winnipeg-manitoba-11-23-2025/event/110062C58F322374
17FZvxG62Xr-oiV,"Skillet, Jeremy Camp, We Are Messengers: The Awakening Tour",Skillet,2025-11-23,19:00:00,Von Braun Center Propst Arena,Huntsville,United States Of America,https://www.ticketmaster.com/skillet-jeremy-camp-we-are-messengers-huntsville-alabama-11-23-2025/event/200062FF9E851B34
